<?xml version="1.0" encoding="UTF-8"?>
<?xml-stylesheet type="text/xsl" href="inventario.xsl"?>
<inventario xmlns:xsi="http://www.w3.org/2001/XMLSchema-instance"
            xsi:noNamespaceSchemaLocation="esquema.xsd"
            version="2.4.1">

    <empresa>
        <nombre>MoGarry Corp.</nombre>
        <cif>B12345678</cif>
        <fecha-inventario>2026-05-13</fecha-inventario>
        <responsable>Sergio Manzano</responsable>
    </empresa>

    <salas>
        <sala id="SALA-A">
            <nombre>Sala A - Producción</nombre>
            <capacidad-u>160</capacidad-u>
            <temperatura-objetivo>21.5</temperatura-objetivo>
            <certificacion>Tier III</certificacion>
        </sala>
        <sala id="SALA-B">
            <nombre>Sala B - Backup</nombre>
            <capacidad-u>160</capacidad-u>
            <temperatura-objetivo>22.0</temperatura-objetivo>
            <certificacion>Tier III</certificacion>
        </sala>
        <sala id="SALA-C">
            <nombre>Sala C - SOC y Networking</nombre>
            <capacidad-u>160</capacidad-u>
            <temperatura-objetivo>21.0</temperatura-objetivo>
            <certificacion>Tier III</certificacion>
        </sala>
    </salas>

    <equipos>

        <equipo id="EQ-001" tipo="servidor" estado="operativo">
            <fabricante>HPE</fabricante>
            <modelo>ProLiant DL380 Gen11</modelo>
            <numero-serie>HPE-DL380-2024-A001</numero-serie>
            <ubicacion sala="SALA-A" rack="R-04" unidad="U12"/>
            <red>
                <ip>10.50.10.21</ip>
                <mac>00:1A:2B:3C:4D:5E</mac>
                <vlan>50</vlan>
            </red>
            <fecha-compra>2024-03-15</fecha-compra>
            <fin-garantia>2027-03-15</fin-garantia>
            <servicios>
                <servicio>Hipervisor VMware vSphere</servicio>
                <servicio>Cluster de virtualización</servicio>
            </servicios>
        </equipo>

        <equipo id="EQ-002" tipo="servidor" estado="operativo">
            <fabricante>HPE</fabricante>
            <modelo>ProLiant DL380 Gen11</modelo>
            <numero-serie>HPE-DL380-2024-A002</numero-serie>
            <ubicacion sala="SALA-A" rack="R-04" unidad="U14"/>
            <red>
                <ip>10.50.10.22</ip>
                <mac>00:1A:2B:3C:4D:5F</mac>
                <vlan>50</vlan>
            </red>
            <fecha-compra>2024-03-15</fecha-compra>
            <fin-garantia>2027-03-15</fin-garantia>
            <servicios>
                <servicio>Hipervisor VMware vSphere</servicio>
                <servicio>Cluster de virtualización</servicio>
            </servicios>
        </equipo>

        <equipo id="EQ-003" tipo="switch" estado="operativo">
            <fabricante>Cisco</fabricante>
            <modelo>Nexus 9336C-FX2</modelo>
            <numero-serie>CSC-NX9336-2024-001</numero-serie>
            <ubicacion sala="SALA-C" rack="R-01" unidad="U01"/>
            <red>
                <ip>10.50.1.10</ip>
                <mac>00:0C:29:AA:BB:01</mac>
                <vlan>1</vlan>
            </red>
            <fecha-compra>2024-01-20</fecha-compra>
            <fin-garantia>2029-01-20</fin-garantia>
            <servicios>
                <servicio>Switching core - 100GbE</servicio>
            </servicios>
        </equipo>

        <equipo id="EQ-004" tipo="firewall" estado="operativo">
            <fabricante>Palo Alto Networks</fabricante>
            <modelo>PA-3260 NGFW</modelo>
            <numero-serie>PAN-PA3260-2024-001</numero-serie>
            <ubicacion sala="SALA-C" rack="R-01" unidad="U03"/>
            <red>
                <ip>10.50.1.1</ip>
                <mac>00:0C:29:AA:BB:02</mac>
                <vlan>1</vlan>
            </red>
            <fecha-compra>2024-01-20</fecha-compra>
            <fin-garantia>2027-01-20</fin-garantia>
            <servicios>
                <servicio>Firewall perimetral</servicio>
                <servicio>Inspección SSL</servicio>
                <servicio>IPS/IDS</servicio>
            </servicios>
        </equipo>

        <equipo id="EQ-005" tipo="nas" estado="operativo">
            <fabricante>NetApp</fabricante>
            <modelo>AFF A400</modelo>
            <numero-serie>NTA-AFF400-2023-001</numero-serie>
            <ubicacion sala="SALA-A" rack="R-05" unidad="U20"/>
            <red>
                <ip>10.50.20.10</ip>
                <mac>00:A0:98:11:22:33</mac>
                <vlan>20</vlan>
            </red>
            <fecha-compra>2023-09-10</fecha-compra>
            <fin-garantia>2028-09-10</fin-garantia>
            <servicios>
                <servicio>Almacenamiento NAS principal</servicio>
                <servicio>Snapshots automáticos</servicio>
            </servicios>
        </equipo>

        <equipo id="EQ-006" tipo="nas" estado="operativo">
            <fabricante>NetApp</fabricante>
            <modelo>AFF A400</modelo>
            <numero-serie>NTA-AFF400-2023-002</numero-serie>
            <ubicacion sala="SALA-B" rack="R-02" unidad="U20"/>
            <red>
                <ip>10.50.20.11</ip>
                <mac>00:A0:98:11:22:34</mac>
                <vlan>20</vlan>
            </red>
            <fecha-compra>2023-09-10</fecha-compra>
            <fin-garantia>2028-09-10</fin-garantia>
            <servicios>
                <servicio>Backup offsite</servicio>
                <servicio>Replicación SnapMirror</servicio>
            </servicios>
        </equipo>

        <equipo id="EQ-007" tipo="router" estado="operativo">
            <fabricante>Cisco</fabricante>
            <modelo>ASR 1001-HX</modelo>
            <numero-serie>CSC-ASR1001-2023-001</numero-serie>
            <ubicacion sala="SALA-C" rack="R-01" unidad="U05"/>
            <red>
                <ip>10.50.0.1</ip>
                <mac>00:0C:29:AA:BB:03</mac>
                <vlan>1</vlan>
            </red>
            <fecha-compra>2023-06-01</fecha-compra>
            <fin-garantia>2028-06-01</fin-garantia>
            <servicios>
                <servicio>Routing perimetral</servicio>
                <servicio>BGP multi-homing</servicio>
            </servicios>
        </equipo>

        <equipo id="EQ-008" tipo="sai" estado="operativo">
            <fabricante>APC</fabricante>
            <modelo>Symmetra PX 80kW</modelo>
            <numero-serie>APC-SPX80-2022-001</numero-serie>
            <ubicacion sala="SALA-A" rack="R-00" unidad="U00"/>
            <fecha-compra>2022-05-12</fecha-compra>
            <fin-garantia>2027-05-12</fin-garantia>
            <servicios>
                <servicio>SAI redundante N+1</servicio>
            </servicios>
        </equipo>

        <equipo id="EQ-009" tipo="servidor" estado="mantenimiento">
            <fabricante>HPE</fabricante>
            <modelo>ProLiant DL360 Gen10</modelo>
            <numero-serie>HPE-DL360-2020-A015</numero-serie>
            <ubicacion sala="SALA-A" rack="R-06" unidad="U08"/>
            <red>
                <ip>10.50.10.45</ip>
                <mac>00:1A:2B:3C:4D:60</mac>
                <vlan>50</vlan>
            </red>
            <fecha-compra>2020-11-22</fecha-compra>
            <fin-garantia>2025-11-22</fin-garantia>
            <servicios>
                <servicio>Servidor de monitorización Zabbix</servicio>
            </servicios>
        </equipo>

        <equipo id="EQ-010" tipo="firewall" estado="almacen">
            <fabricante>Fortinet</fabricante>
            <modelo>FortiGate 200F</modelo>
            <numero-serie>FTN-FG200F-2024-001</numero-serie>
            <ubicacion sala="SALA-C" rack="R-99" unidad="U00"/>
            <fecha-compra>2024-11-05</fecha-compra>
            <fin-garantia>2029-11-05</fin-garantia>
            <servicios>
                <servicio>Equipo de respaldo (sin desplegar)</servicio>
            </servicios>
        </equipo>

    </equipos>
</inventario>